call_id,speaker,transcript,is_urgent,used_threat,good_offers,request_money_transfer,request_personal_info,request_banking_info,request_passwords,request_code,is_vishing
1,المتصل,أهلاً أستاذ محمد معك مشعل من بنك الراجحي حبيت أبلغك إنك مؤهل لعرض خاص على تمويل شخصي بنسبة ربح مخفضة,0,0,1,0,0,0,0,0,0
1,الطرف الآخر,ممتاز وش تفاصيل العرض,0,0,1,0,0,0,0,0,0
1,المتصل,التمويل بدون رسوم إدارية ولمدة محدودة تفضل أكمل لك البيانات لو حاب,0,0,1,0,0,0,0,0,0
2,المتصل,أستاذ عبدالله تم رصد تأخير في سداد آخر قسط من القرض لازم تتم التسوية خلال يومين,1,1,0,0,0,0,0,0,0
2,الطرف الآخر,والله ما وصلني تنبيه متى كان مستحق,1,1,0,0,0,0,0,0,0
2,المتصل,في حال ما تم السداد ممكن يتأثر سجلّك الائتماني ونتمنى ما نوصل لها النقطة,1,1,0,0,0,0,0,0,0
3,المتصل,"السلام عليكم، معك أحمد من خدمة عملاء البنك الأهلي",0,0,0,0,0,0,0,0,0
3,الطرف الآخر,وعليكم السلام,0,0,0,0,0,0,0,0,0
3,المتصل,نتصل للتأكيد على عملية شراء تمت على بطاقتك بمبلغ 500 ريال من متجر إلكتروني هل هذه العملية صحيحة,0,0,0,0,0,0,0,0,0
3,الطرف الآخر,نعم اشتريت جهاز كمبيوتر أمس,0,0,0,0,0,0,0,0,0
3,المتصل,شكراً لك العملية مؤكدة. هل تحتاج أي مساعدة أخرى,0,0,0,0,0,0,0,0,0
4,المتصل,السلام عليكم معك قسم الأمان في بنك الراجحي,0,0,0,0,0,0,0,0,1
4,الطرف الآخر,وعليكم السلام,0,0,0,0,0,0,0,0,1
4,المتصل,حسابك تعرض لاختراق نحتاج تأكيد هويتك عشان نحميه,1,1,0,0,1,1,0,0,1
4,الطرف الآخر,كيف,0,0,0,0,0,0,0,0,1
4,المتصل,أرسل لك رمز تأكيد على الجوال قول لي الرقم عشان نأمن الحساب,1,0,0,0,0,0,0,1,1
4,الطرف الآخر,بس ليش تبون الرمز,0,0,0,0,0,0,0,0,1
4,المتصل,لازم نتأكد إنك صاحب الحساب والله لو ما سويت كذا راح يسرقون فلوسك كلها,1,1,0,0,0,0,0,0,1
5,المتصل,مبروك كسبت جائزة 50000 ريال من مسابقة مقدمة من البنك,0,0,1,0,0,0,0,0,1
5,الطرف الآخر,مسابقة إيش,0,0,0,0,0,0,0,0,1
5,المتصل,مسابقة العملاء المميزين بس نحتاج نتأكد من بياناتك,0,0,1,0,1,0,0,0,1
5,الطرف الآخر,إيش تبون,0,0,0,0,0,0,0,0,1
5,المتصل,رقم الهوية ورقم البطاقة البنكية عشان نحول لك الجائزة,0,0,1,1,1,1,0,0,1
5,الطرف الآخر,وليش البطاقة,0,0,0,0,0,0,0,0,1
5,المتصل,هذا نظام البنك والله العرض لمدة ساعة بس,1,0,1,0,0,0,0,0,1
6,المتصل, عندك مخالفات مرورية تحتاج الى السداد ,0,0,0,0,0,0,0,0,1
6,الطرف الآخر,مخالفات إيش,0,0,0,0,0,0,0,0,1
6,المتصل,لازم تدفع غرامة 2000 ريال خلال ساعة والا راح نوقف حسابك البنكي,1,1,0,1,0,0,0,0,1
6,الطرف الآخر,وكيف أدفع,0,0,0,0,0,0,0,0,1
6,المتصل,حول المبلغ على هذا الحساب وأرسل لي صورة الإيصال,1,0,0,1,0,0,0,0,1
7,المتصل,عندك فرصة ذهبية للاستثمار في العملات الرقمية,0,0,1,0,0,0,0,0,1
7,الطرف الآخر,إيش هالفرصة,0,0,0,0,0,0,0,0,1
7,المتصل,لو حولت 10000 ريال اليوم خلال أسبوع تصير 50000,1,0,1,1,0,0,0,0,1
7,الطرف الآخر,مضمونة,0,0,0,0,0,0,0,0,1
7,المتصل,والله مضمونة 100 بس لازم تحول الحين قبل ما ينتهي العرض,1,0,1,1,0,0,0,0,1
8,المتصل,من جمعية خيرية نجمع تبرعات للأيتام,0,0,0,0,0,0,0,0,1
8,الطرف الآخر,أي جمعية,0,0,0,0,0,0,0,0,1
8,المتصل,جمعية الخير تقدر تتبرع ب 500 ريال,0,0,0,1,0,0,0,0,1
8,الطرف الآخر,كيف أتبرع,0,0,0,0,0,0,0,0,1
8,المتصل,حول على هذا الحساب والله الأطفال محتاجين,0,0,0,1,0,0,0,0,1
9,المتصل,معك من البنك السعودي للاستثمار حسابك محجوز,0,1,0,0,0,0,0,0,1
9,الطرف الآخر,ليش محجوز,0,0,0,0,0,0,0,0,1
9,المتصل,عمليات مشبوهة نحتاج رقم البطاقة عشان نفكه,0,1,0,0,0,1,0,0,1
9,الطرف الآخر,بس أنا ما سويت شي,0,0,0,0,0,0,0,0,1
9,المتصل,لازم تعطيني الرقم الحين والا راح يقفل نهائياً,1,1,0,0,0,1,0,0,1
10,المتصل,كسبت رحلة مجانية لدبي من طيران ناس بالتعاون مع بنكنا,0,0,1,0,0,0,0,0,1
10,الطرف الآخر,كيف كسبت,0,0,0,0,0,0,0,0,1
10,المتصل,سحب عشوائي على العملاء بس نحتاج رسوم الحجز 800 ريال,0,0,1,1,0,0,0,0,1
10,الطرف الآخر,ليش رسوم,0,0,0,0,0,0,0,0,1
10,المتصل,رسوم إدارية بسيطة حول الحين قبل ما ينتهي السحب,1,0,1,1,0,0,0,0,1
11,المتصل,بطاقتك الي في ابل باي تعرضت للاختراق,0,1,0,0,0,0,0,0,1
11,الطرف الآخر,كيف عرفتو,0,0,0,0,0,0,0,0,1
11,المتصل,عندنا نظام مراقبة نحتاج رقم الحساب وكلمة السر عشان نحميه,0,0,0,0,1,0,1,0,1
11,الطرف الآخر,بس ليش تبونها,0,0,0,0,0,0,0,0,1
11,المتصل,عشان نغير الإعدادات الأمنية لازم نسوي كذا الحين,1,0,0,0,0,0,0,0,1
12,المتصل,معك البنك و تواصلوا معنا الهيئة العامة للزكاة عليك مبلغ زكاة,0,0,0,0,0,0,0,0,1
12,الطرف الآخر,كم المبلغ,0,0,0,0,0,0,0,0,1
12,المتصل,15000 ريال ولازم تدفع خلال 24 ساعة,1,1,0,1,0,0,0,0,1
12,الطرف الآخر,وكيف أدفع,0,0,0,0,0,0,0,0,1
12,المتصل,حول على حساب الهيئة هذا وأرسل لي صورة الإيصال عشان نسجل الدفع,1,0,0,1,0,0,0,0,1
13,المتصل,مبروك ربحت سيارة لكزس من البنك بالتعاون مع معرض الجميح,0,0,1,0,0,0,0,0,1
13,الطرف الآخر,كيف ربحت,0,0,0,0,0,0,0,0,1
13,المتصل,قرعة على الزوار بس نحتاج نتأكد من الهوية,0,0,1,0,1,0,0,0,1
13,الطرف الآخر,إيش تبون,0,0,0,0,0,0,0,0,1
13,المتصل,صورة الهوية ورقم الحساب عشان نسجل السيارة,0,0,1,0,1,1,0,0,1
13,الطرف الآخر,والله,0,0,0,0,0,0,0,0,1
13,المتصل,ايه والله بس العرض ينتهي خلال ساعتين,1,0,1,0,0,0,0,0,1
14,المتصل, وزارة الصحة تواصلوا معنا البنك و قالوا تطعيمك كورونا منتهي الصلاحية,0,0,0,0,0,0,0,0,1
14,الطرف الآخر,إيش المطلوب,0,0,0,0,0,0,0,0,1
14,المتصل,لازم تجدد ب 200 ريال والا ما تقدر تسافر,1,1,0,1,0,0,0,0,1
14,الطرف الآخر,وكيف أجدد,0,0,0,0,0,0,0,0,1
14,المتصل,حول المبلغ على حساب الوزارة وأرسل لي الإيصال,1,0,0,1,0,0,0,0,1
15,المتصل,جاء البنك رساله عندك مشكلة في الدفع لحساب نتفليكس ,0,1,0,0,0,0,0,0,1
15,الطرف الآخر,إيش المشكلة,0,0,0,0,0,0,0,0,1
15,المتصل,مشكلة في الدفع نحتاج بيانات البطاقة الجديدة عشان نغير لك الدفع,0,0,0,0,0,1,0,0,1
15,الطرف الآخر,بس أنا ما غيرت شي,0,0,0,0,0,0,0,0,1
15,المتصل,لازم تحديث البيانات خلال ساعة والا الحساب راح يتمسح,1,1,0,0,0,0,0,0,1
16,المتصل, مكتب العمل بلغوا البنك ان راتبك محجوز,0,1,0,0,0,0,0,0,1
16,الطرف الآخر,ليش محجوز,0,0,0,0,0,0,0,0,1
16,المتصل,مشكلة في الأوراق نحتاج رقم الآيبان عشان نحل المشكلة,0,0,0,0,0,1,0,0,1
16,الطرف الآخر,وإيش المشكلة بالضبط,0,0,0,0,0,0,0,0,1
16,المتصل,ما أقدر أقول بالتليفون بس لازم تعطيني الرقم الحين,1,0,0,0,0,0,0,0,1
17,المتصل,السلام عليكم معك من قسم الحماية بالبنك حصلنا محاولة دخول مشبوهة,1,1,0,0,0,0,0,0,1
17,الطرف الآخر,وش نوع المحاولة,0,0,0,0,0,0,0,0,1
17,المتصل,نحتاج الكود الي وصلك عشان نلغي العملية,0,1,0,0,0,0,0,1,1
17,الطرف الآخر,طيب دقيقة اشوف الرسالة,0,0,0,0,0,0,0,0,1
17,المتصل,ها بسرعة وصلك الكود؟,1,0,0,0,0,0,0,0,1
18,المتصل,أهلاً أستاذة نورة معك خالد من البنك الأهلي حاب أتأكد من بعض البيانات لتحديث ملفك,0,0,0,0,1,0,0,0,0
18,الطرف الآخر,تفضل وش المطلوب,0,0,0,0,1,0,0,0,0
18,المتصل,فقط رقم الهوية وتاريخ الميلاد اللي عندك عشان نحدثها بالنظام,0,0,0,0,1,0,0,0,0
19,المتصل,مرحبا معك نورة من بنك البلاد نؤكد على تحديث بياناتك,0,0,0,0,1,0,0,0,0
19,الطرف الآخر,ايه حدثتها قبل اسبوع,0,0,0,0,0,0,0,0,0
19,المتصل,ممتاز فقط تأكيد شكرا لتعاونك,0,0,0,0,0,0,0,0,0
20,المتصل,نحن من البنك تم حظر بطاقتك نحتاج الكود الآن,1,1,0,0,0,1,0,1,1
20,الطرف الآخر,ايش المقصود,1,0,0,0,0,0,0,0,1
20,المتصل,اذا ما وصل الكود راح يتم تجميد الحساب,1,1,0,0,0,1,0,1,1
21,المتصل,السلام عليكم انا من خدمة عملاء بنك الانماء نتابع طلبك للقرض الشخصي,0,0,1,0,0,0,0,0,0
21,الطرف الآخر,تمام متى راح يتم الاتصال بي,0,0,0,0,0,0,0,0,0
21,المتصل,راح يتواصل معك الموظف خلال يومين,0,0,0,0,0,0,0,0,0
22,المتصل,فيه محاولة سحب مشبوهة من حسابك نحتاج رقم الهوية الآن,1,1,0,0,1,1,0,0,1
22,الطرف الآخر,بس ما استلمت تنبيه من التطبيق,1,0,0,0,0,0,0,0,1
22,المتصل,لان الهجوم خارجي لازم نتأكد بسرعة,1,1,0,0,1,1,0,0,1
23,المتصل,مساء الخير معك هاني من بنك الراجحي فقط نأكد عنوان التوصيل للبطاقة,0,0,0,0,0,0,0,0,0
23,الطرف الآخر,العنوان حي الشفا شارع النور,0,0,0,0,0,0,0,0,0
23,المتصل,تم تسجيله بنجاح شكرا لك,0,0,0,0,0,0,0,0,0
24,المتصل,لديك نقاط مجانية سيتم حذفها اذا ما فعلتها الآن,1,1,1,0,0,0,0,1,1
24,الطرف الآخر,كيف افعلها,1,0,0,0,0,0,0,0,1
24,المتصل,ارسل لي كود التفعيل اللي وصلك برسالة,1,0,0,0,0,0,0,1,1
25,المتصل,نبلغك ان كشف الحساب الشهري متاح عبر التطبيق,0,0,0,0,0,0,0,0,0
25,الطرف الآخر,ممتاز شكرا لكم,0,0,0,0,0,0,0,0,0
25,المتصل,هل تود الاشتراك في التنبيهات المجانية,0,0,1,0,0,0,0,0,0
26,المتصل,فيه تحديث جديد لازم تدخل معلوماتك البنكية الآن,1,1,0,0,0,1,0,0,1
26,الطرف الآخر,ايش نوع التحديث,1,0,0,0,0,0,0,0,1
26,المتصل,لحماية الحساب من الإيقاف الدائم,1,1,0,0,0,1,0,0,1
27,المتصل,هل تم تسليم البطاقة البنكية الجديدة لك,0,0,0,0,0,0,0,0,0
27,الطرف الآخر,نعم استلمتها اليوم,0,0,0,0,0,0,0,0,0
27,المتصل,ممتاز تقدر تفعلها من التطبيق بسهولة,0,0,0,0,0,0,0,0,0
28,المتصل,تم الدخول لحسابك من جهاز غير معروف نحتاج كلمة السر الآن,1,1,0,0,0,1,1,0,1
28,الطرف الآخر,لحظة ما اعطيت احد بياناتي,1,0,0,0,0,0,0,0,1
28,المتصل,عشان كذا لازم تأكد هويتك بإرسال كلمة السر,1,1,0,0,1,1,1,0,1
29,المتصل,السلام عليكم معك عبدالله من بنك الراجحي نؤكد تحديث بياناتك,0,0,0,0,1,0,0,0,0
29,الطرف الآخر,ايه تمام بس ليش الاتصال,0,0,0,0,0,0,0,0,0
29,المتصل,روتين سنوي للتأكد من رقم الهوية,0,0,0,0,1,0,0,0,0
29,الطرف الآخر,انا محدث البيانات قبل شهر,0,0,0,0,0,0,0,0,0
29,المتصل,ممتاز شكرا لتعاونك,0,0,0,0,0,0,0,0,0
30,المتصل,مرحبا حسابك البنكي فيه محاولة اختراق,1,1,0,0,0,0,0,0,1
30,الطرف الآخر,كيف صار هذا,1,0,0,0,0,0,0,0,1
30,المتصل,نحتاج رمز التحقق اللي وصلك عشان نوقف العملية,1,0,0,0,0,0,0,1,1
30,الطرف الآخر,بس انا ما استلمت شي,1,0,0,0,0,0,0,0,1
30,المتصل,خلال دقيقة بيوصلك أرسله لي بسرعة,1,1,0,0,0,0,0,1,1
31,المتصل,مبروك ربحت 10000 ريال من قرعة بنك الأهلي,0,0,1,0,0,0,0,0,1
31,الطرف الآخر,جد كيف ربحت,0,0,0,0,0,0,0,0,1
31,المتصل,من سحب العملاء بس نحتاج رقم الحساب,0,0,1,0,0,1,0,0,1
31,الطرف الآخر,ليش الحساب,0,0,0,0,0,0,0,0,1
31,المتصل,عشان نحول المبلغ خلال ساعة والا يروح,1,0,1,0,0,0,0,0,1
32,المتصل,مرحبا معك من بنك الإنماء نتابع طلب بطاقتك,0,0,0,0,0,0,0,0,0
32,الطرف الآخر,ايه متى بتوصل,0,0,0,0,0,0,0,0,0
32,المتصل,خلال يومين للعنوان المسجل,0,0,0,0,0,0,0,0,0
33,المتصل,حسابك في خطر نحتاج رقم البطاقة للحماية,1,1,0,0,0,1,0,0,1
33,الطرف الآخر,بس التطبيق ما نبهني,1,0,0,0,0,0,0,0,1
33,المتصل,المشكلة خارجية لازم الرقم الحين,1,1,0,0,0,1,0,0,1
34,المتصل,السلام عليكم من بنك البلاد نؤكد عملية شراء ب 2000 ريال,0,0,0,0,0,0,0,0,0
34,الطرف الآخر,ايه صحيح اشتريت تلفزيون,0,0,0,0,0,0,0,0,0
34,المتصل,تمام شكرا للتأكيد,0,0,0,0,0,0,0,0,0
35,المتصل,فيه عرض استثماري ربح 200 بالمية خلال شهر,0,0,1,0,0,0,0,0,1
35,الطرف الآخر,كيف هذا,0,0,0,0,0,0,0,0,1
35,المتصل,حول 5000 ريال اليوم ونشتري أسهم,1,0,1,1,0,0,0,0,1
35,الطرف الآخر,مضمون,0,0,0,0,0,0,0,0,1
35,المتصل,100 بالمية بس لازم تحول الحين,1,0,1,1,0,0,0,0,1
36,المتصل,مرحبا من بنك الراجحي نرسل كشف الحساب,0,0,0,0,0,0,0,0,0
36,الطرف الآخر,ايه وين ألاقيه,0,0,0,0,0,0,0,0,0
36,المتصل,في التطبيق قسم الكشوفات,0,0,0,0,0,0,0,0,0
37,المتصل,معك من الأمن السيبراني حسابك فيه مشكلة,1,1,0,0,0,0,0,0,1
37,الطرف الآخر,ايش المشكلة,1,0,0,0,0,0,0,0,1
37,المتصل,نحتاج كلمة السر لتأمين الحساب,1,1,0,0,0,0,1,0,1
38,المتصل,مبروك كسبت تذكرة طيران مجانية من البنك,0,0,1,0,0,0,0,0,1
38,الطرف الآخر,جد كيف,0,0,0,0,0,0,0,0,1
38,المتصل,نحتاج رسوم تسجيل 300 ريال,0,0,1,1,0,0,0,0,1
39,المتصل,معك من خدمة العملاء نؤكد موعد تسليم البطاقة,0,0,0,0,0,0,0,0,0
39,الطرف الآخر,ايه متى,0,0,0,0,0,0,0,0,0
39,المتصل,بكرة الساعة ٤ العصر,0,0,0,0,0,0,0,0,0
40,المتصل,فيه مخالفة على حسابك 3000 ريال,1,1,0,1,0,0,0,0,1
40,الطرف الآخر,مخالفة ايه,1,0,0,0,0,0,0,0,1
40,المتصل,عملية مشبوهة حول المبلغ الحين,1,1,0,1,0,0,0,0,1
41,المتصل,مرحبا من بنك الأهلي بخصوص القرض,0,0,0,0,0,0,0,0,0
41,الطرف الآخر,ايه وصلتني الموافقة,0,0,0,0,0,0,0,0,0
41,المتصل,تمام بنرسل التفاصيل على الايميل,0,0,0,0,0,0,0,0,0
42,المتصل,حسابك معرض للإغلاق نحتاج رمز التحقق,1,1,0,0,0,0,0,1,1
42,الطرف الآخر,ليش يتقفل,1,0,0,0,0,0,0,0,1
42,المتصل,محاولة دخول غير مصرحة أرسل الرمز,1,1,0,0,0,0,0,1,1
43,المتصل,السلام عليكم نؤكد عملية شراء ب 1500 ريال,0,0,0,0,0,0,0,0,0
43,الطرف الآخر,ايه صحيح اشتريت جوال,0,0,0,0,0,0,0,0,0
43,المتصل,شكرا للتأكيد,0,0,0,0,0,0,0,0,0
44,المتصل,مبروك ربحت 20000 ريال من مسابقة البنك,0,0,1,0,0,0,0,0,1
44,الطرف الآخر,جد كيف,0,0,0,0,0,0,0,0,1
44,المتصل,نحتاج رقم الهوية لتسجيل الجائزة,0,0,1,0,1,0,0,0,1
45,المتصل,مرحبا من بنك الإنماء نتابع طلب البطاقة,0,0,0,0,0,0,0,0,0
45,الطرف الآخر,ايه طلب البطاقة,0,0,0,0,0,0,0,0,0
45,المتصل,تم الشحن بتصلك خلال يومين,0,0,0,0,0,0,0,0,0
46,المتصل,حسابك فيه مشكلة أمنية نحتاج رقم البطاقة,1,1,0,0,0,1,0,0,1
46,الطرف الآخر,بس ما وصلني تنبيه,1,0,0,0,0,0,0,0,1
46,المتصل,المشكلة جديدة لازم الرقم الحين,1,1,0,0,0,1,0,0,1
47,المتصل,السلام عليكم نتصل بخصوص تحديث العنوان,0,0,0,0,1,0,0,0,0
47,الطرف الآخر,ايه العنوان حي النخيل,0,0,0,0,0,0,0,0,0
47,المتصل,تم التسجيل شكرا,0,0,0,0,0,0,0,0,0
48,المتصل,فيه عرض استثمار مضمون 300 بالمية,0,0,1,0,0,0,0,0,1
48,الطرف الآخر,كيف مضمون,0,0,0,0,0,0,0,0,1
48,المتصل,حول 10000 ريال اليوم ونشتري أسهم,1,0,1,1,0,0,0,0,1
49,المتصل,مرحبا من بنك الراجحي نؤكد تسليم البطاقة,0,0,0,0,0,0,0,0,0
49,الطرف الآخر,ايه متى بيكون,0,0,0,0,0,0,0,0,0
49,المتصل,اليوم بعد العصر,0,0,0,0,0,0,0,0,0
50,المتصل,حسابك تم اختراقه نحتاج كلمة السر,1,1,0,0,0,0,1,0,1
50,الطرف الآخر,بس انا ما اعطيت احد شي,1,0,0,0,0,0,0,0,1
50,المتصل,لازم كلمة السر الحين والا يضيع الحساب,1,1,0,0,0,0,1,0,1
51,المتصل,السلام عليكم من بنك الأهلي بخصوص القرض,0,0,0,0,0,0,0,0,0
51,الطرف الآخر,ايه وصلتني الأوراق,0,0,0,0,0,0,0,0,0
51,المتصل,تمام بنرسل التفاصيل النهائية,0,0,0,0,0,0,0,0,0
52,المتصل,مبروك كسبت 15000 ريال من مسابقة البنك,0,0,1,0,0,0,0,0,1
52,الطرف الآخر,من وين جت الجائزة,0,0,0,0,0,0,0,0,1
52,المتصل,سحب عشوائي بس نحتاج رقم الحساب,0,0,1,0,0,1,0,0,1
53,المتصل,مرحبا من بنك الإنماء بخصوص كشف الحساب,0,0,0,0,0,0,0,0,0
53,الطرف الآخر,ايه وين ألاقيه,0,0,0,0,0,0,0,0,0
53,المتصل,في التطبيق قسم الكشوفات,0,0,0,0,0,0,0,0,0
54,المتصل,فيه مشكلة دفع في حسابك نحتاج بيانات البطاقة,1,1,0,0,0,1,0,0,1
54,الطرف الآخر,ايش المشكلة,1,0,0,0,0,0,0,0,1
54,المتصل,عملية مرفوضة لازم تحدث البيانات الحين,1,1,0,0,0,1,0,0,1
55,المتصل,السلام عليكم من بنك الراجحي نؤكد عنوان التوصيل,0,0,0,0,0,0,0,0,0
55,الطرف الآخر,العنوان حي الروضة شارع الملك,0,0,0,0,0,0,0,0,0
55,المتصل,تم التسجيل شكرا,0,0,0,0,0,0,0,0,0
56,المتصل,حسابك فيه نشاط مشبوه نحتاج رمز التحقق,1,1,0,0,0,0,0,1,1
56,الطرف الآخر,ما وصلني شي,1,0,0,0,0,0,0,0,1
56,المتصل,بيوصلك الحين أرسله بسرعة,1,1,0,0,0,0,0,1,1
57,المتصل,مرحبا من بنك الأهلي بخصوص طلب التمويل,0,0,0,0,0,0,0,0,0
57,الطرف الآخر,ايه متى الموافقة,0,0,0,0,0,0,0,0,0
57,المتصل,خلال ٤٨ ساعة بنبلغك,0,0,0,0,0,0,0,0,0
58,المتصل,مبروك ربحت 50000 ريال من قرعة البنك,0,0,1,0,0,0,0,0,1
58,الطرف الآخر,كيف ربحت,0,0,0,0,0,0,0,0,1
58,المتصل,نحتاج رقم الهوية والحساب للتحويل,0,0,1,0,1,1,0,0,1
58,الطرف الآخر,ليش الهوية,0,0,0,0,0,0,0,0,1
58,المتصل,لتأكد من هويتك العرض ينتهي اليوم,1,0,1,0,0,0,0,0,1
59,المتصل,السلام عليكم من بنك الإنماء نتابع طلب البطاقة,0,0,0,0,0,0,0,0,0
59,الطرف الآخر,ايه وصلتني,0,0,0,0,0,0,0,0,0
59,المتصل,تمام تقدر تفعلها من التطبيق,0,0,0,0,0,0,0,0,0
60,المتصل,حسابك في خطر نحتاج كلمة السر للحماية,1,1,0,0,0,0,1,0,1
60,الطرف الآخر,بس ما شفت شي غريب,1,0,0,0,0,0,0,0,1
60,المتصل,لازم كلمة السر الحين والا يضيع كل شي,1,1,0,0,0,0,1,0,1
61,المتصل,مرحبا من بنك الراجحي بخصوص كشف الحساب,0,0,0,0,0,0,0,0,0
61,الطرف الآخر,ايه وين ألاقيه,0,0,0,0,0,0,0,0,0
61,المتصل,في التطبيق قسم الكشوفات,0,0,0,0,0,0,0,0,0
62,المتصل,فيه عرض استثمار ربح 500 بالمية,0,0,1,0,0,0,0,0,1
62,الطرف الآخر,كيف هذا ممكن,0,0,0,0,0,0,0,0,1
62,المتصل,حول 20000 ريال اليوم ونشتري أسهم,1,0,1,1,0,0,0,0,1
63,المتصل,السلام عليكم من بنك الأهلي نؤكد عملية شراء,0,0,0,0,0,0,0,0,0
63,الطرف الآخر,ايه اشتريت لاب توب,0,0,0,0,0,0,0,0,0
63,المتصل,تمام شكرا للتأكيد,0,0,0,0,0,0,0,0,0
64,المتصل,حسابك تم حظره نحتاج رمز التحقق,1,1,0,0,0,0,0,1,1
64,الطرف الآخر,ليش الحظر,1,0,0,0,0,0,0,0,1
64,المتصل,محاولة اختراق أرسل الرمز الحين,1,1,0,0,0,0,0,1,1
65,المتصل,مرحبا من بنك الإنماء بخصوص القرض,0,0,0,0,0,0,0,0,0
65,الطرف الآخر,ايه متى ينزل المبلغ,0,0,0,0,0,0,0,0,0
65,المتصل,خلال يومين بنرسل التفاصيل,0,0,0,0,0,0,0,0,0
66,المتصل,مبروك كسبت سيارة من قرعة البنك,0,0,1,0,0,0,0,0,1
66,الطرف الآخر,جد كيف,0,0,0,0,0,0,0,0,1
66,المتصل,نحتاج رسوم تسجيل 5000 ريال,0,0,1,1,0,0,0,0,1
67,المتصل,السلام عليكم من بنك الراجحي نؤكد عنوان التوصيل,0,0,0,0,0,0,0,0,0
67,الطرف الآخر,العنوان حي الملز شارع الرياض,0,0,0,0,0,0,0,0,0
67,المتصل,تم التسجيل شكرا,0,0,0,0,0,0,0,0,0
68,المتصل,فيه مشكلة في حسابك نحتاج رقم البطاقة,1,1,0,0,0,1,0,0,1
68,الطرف الآخر,ايش المشكلة بالضبط,1,0,0,0,0,0,0,0,1
68,المتصل,عملية مشبوهة لازم تحدث البيانات الحين,1,1,0,0,0,1,0,0,1
69,المتصل,مرحبا من بنك الأهلي نتابع طلب البطاقة,0,0,0,0,0,0,0,0,0
69,الطرف الآخر,ايه متى بتوصل,0,0,0,0,0,0,0,0,0
69,المتصل,بكرة الظهر بنوصلها,0,0,0,0,0,0,0,0,0
70,المتصل,حسابك في خطر نحتاج كلمة السر,1,1,0,0,0,0,1,0,1
70,الطرف الآخر,بس ما شفت شي غريب,1,0,0,0,0,0,0,0,1
70,المتصل,لازم كلمة السر الحين والا يضيع الحساب,1,1,0,0,0,0,1,0,1
71,المتصل,السلام عليكم من بنك الإنماء بخصوص كشف الحساب,0,0,0,0,0,0,0,0,0
71,الطرف الآخر,ايه وين ألاقيه,0,0,0,0,0,0,0,0,0
71,المتصل,في التطبيق قسم الكشوفات,0,0,0,0,0,0,0,0,0
72,المتصل,مبروك ربحت 30000 ريال من قرعة البنك,0,0,1,0,0,0,0,0,1
72,الطرف الآخر,من وين جت,0,0,0,0,0,0,0,0,1
72,المتصل,سحب عشوائي بس نحتاج رقم الحساب,0,0,1,0,0,1,0,0,1
73,المتصل,مرحبا من بنك الراجحي نؤكد تحديث بياناتك,0,0,0,0,1,0,0,0,0
73,الطرف الآخر,ايه بس ليش,0,0,0,0,0,0,0,0,0
73,المتصل,روتين للتأكد من الهوية,0,0,0,0,1,0,0,0,0
74,المتصل,فيه مشكلة أمنية نحتاج رمز التحقق,1,1,0,0,0,0,0,1,1
74,الطرف الآخر,ما وصلني شي,1,0,0,0,0,0,0,0,1
74,المتصل,بيوصلك الحين أرسله بسرعة,1,1,0,0,0,0,0,1,1
75,المتصل,السلام عليكم من بنك الأهلي نؤكد عملية شراء ب 3000 ريال,0,0,0,0,0,0,0,0,0
75,الطرف الآخر,ايه اشتريت تذكرة طيران,0,0,0,0,0,0,0,0,0
75,المتصل,تمام شكرا للتأكيد,0,0,0,0,0,0,0,0,0
76,المتصل,حسابك تم اختراقه نحتاج رقم البطاقة,1,1,0,0,0,1,0,0,1
76,الطرف الآخر,بس التطبيق ما نبهني,1,0,0,0,0,0,0,0,1
76,المتصل,المشكلة خارجية أرسل الرقم الحين,1,1,0,0,0,1,0,0,1
77,المتصل,مرحبا من بنك الإنماء بخصوص القرض,0,0,0,0,0,0,0,0,0
77,الطرف الآخر,ايه متى ينزل المبلغ,0,0,0,0,0,0,0,0,0
77,المتصل,خلال ٤٨ ساعة بنبلغك,0,0,0,0,0,0,0,0,0
